[
  {
    "id": "MLS123456",
    "address": "123 Example Rd, Stewardville, NJ",
    "county": "Steward",
    "lat": 39.1234,
    "lng": -74.5678,
    "lot_size_acres": 1.5,
    "flood_risk": "Low",
    "soil_type": "Loam",
    "water_access": true,
    "industrial_distance_km": 2.5,
    "habitability_score": 75,
    "adu_viability": true,
    "neighborhood_stability": "Stable",
    "rehab_tier": "cosmetic",
    "permit_complexity": "low",
    "utility_status": "all active",
    "title_risk": "clear",
    "zoning_ambiguity": "low",
    "environmental_flags": [],
    "red_flags": [],
    "source": "mls",
    "ingested_at": "2025-12-15T12:00:00Z"
  },
  {
    "id": "MLS654321",
    "address": "456 Wetland Ave, Floodplain, NJ",
    "county": "Floodplain",
    "lat": 39.5678,
    "lng": -74.1234,
    "lot_size_acres": 0.3,
    "flood_risk": "High",
    "soil_type": "Clay",
    "water_access": false,
    "industrial_distance_km": 0.8,
    "habitability_score": 55,
    "adu_viability": false,
    "neighborhood_stability": "Transitional",
    "rehab_tier": "structural",
    "permit_complexity": "high",
    "utility_status": "partial",
    "title_risk": "unclear",
    "zoning_ambiguity": "high",
    "environmental_flags": ["environmental_red_flag"],
    "red_flags": ["Uninsurable flood zone"],
    "source": "mls",
    "ingested_at": "2025-12-15T12:00:00Z"
  }
]
